{
  "version": 1,
  "rotate": [
    {
      "file": "CONTEXT.md",
      "line_threshold": 120,
      "keep_last": 80,
      "confidence": 0.9,
      "reason": "High churn file, keep recent context only."
    },
    {
      "file": "DECISIONS.md",
      "line_threshold": 220,
      "keep_last": 140,
      "confidence": 0.7,
      "reason": "Archive only when decision history is too large."
    },
    {
      "file": "LESSONS.md",
      "line_threshold": 180,
      "keep_last": 110,
      "confidence": 0.8,
      "reason": "Keep recent lessons quickly accessible."
    }
  ],
  "tasks": {
    "enabled": true,
    "days": 45,
    "confidence": 0.85,
    "reason": "Completed tasks older than 45 days are usually low signal."
  },
  "limits": {
    "max_files_rotated": 3,
    "max_total_lines_removed": 500,
    "max_archive_chars_added": 120000
  }
}
